{
  "$schema": "https://json-schema.org/draft/2020-12/schema",
  "$id": "https://core-net-skill.dev/schemas/skill-result-summary.schema.json",
  "title": "Sanitized Skill Result Summary",
  "type": "object",
  "required": [
    "case_id",
    "selection_status",
    "selected_boundary",
    "boundary_confidence",
    "evidence_limitations",
    "additional_evidence_needed"
  ],
  "additionalProperties": false,
  "properties": {
    "case_id": {
      "type": "string",
      "pattern": "^[a-z0-9][a-z0-9-]*$"
    },
    "selection_status": {
      "type": "string"
    },
    "selected_boundary": {
      "type": ["object", "null"],
      "required": [
        "selected_source_domain",
        "selected_procedure_family",
        "selected_procedure_stage",
        "deviation_type",
        "boundary_protocol",
        "boundary_message",
        "boundary_frame",
        "boundary_timestamp",
        "evidence_level"
      ],
      "additionalProperties": false,
      "properties": {
        "selected_source_domain": {"type": "string"},
        "selected_procedure_family": {"type": "string"},
        "selected_procedure_stage": {"type": ["string", "null"]},
        "deviation_type": {"type": "string"},
        "boundary_protocol": {"type": "string"},
        "boundary_message": {"type": "string"},
        "boundary_frame": {"type": "integer", "minimum": 1},
        "boundary_timestamp": {"type": "string"},
        "evidence_level": {"type": "string"}
      }
    },
    "boundary_confidence": {
      "type": ["string", "null"]
    },
    "evidence_limitations": {
      "type": "array",
      "items": {"type": "string"}
    },
    "additional_evidence_needed": {
      "type": "array",
      "items": {"type": "string"}
    },
    "domain_instances_count": {
      "type": "integer",
      "minimum": 0,
      "description": "Total procedure instances produced by executed Domain Skills. The count consumed by Orchestration is reported separately as orchestration_status.source_domain_instances_count."
    },
    "candidate_boundaries_count": {
      "type": "integer",
      "minimum": 0
    },
    "domain_status": {
      "type": "object",
      "description": "Per-Domain execution evidence keyed by registration, pdu_session and handover_mobility.",
      "additionalProperties": {
        "type": "object",
        "required": ["execution_status", "output_present", "deviation_count"],
        "additionalProperties": false,
        "properties": {
          "execution_status": {"type": "string"},
          "output_present": {"type": "boolean"},
          "instance_count": {"type": "integer", "minimum": 0},
          "handover_attempt_count": {"type": "integer", "minimum": 0},
          "path_switch_attempt_count": {"type": "integer", "minimum": 0},
          "deviation_count": {"type": "integer", "minimum": 0},
          "first_stop_reason": {"type": ["string", "null"]},
          "deviation_classification": {
            "type": "object",
            "description": "Bounded evidence-type-aware classification of the deviations this Domain actually emitted. Category semantics are shared with the accepted Orchestration contract: candidate_eligible matches ELIGIBLE_DEVIATION_TYPES, evidence_limitation matches EVIDENCE_LIMITATION_TYPES, supporting_anomaly matches SUPPORTING_ANOMALY_TYPES, and every other deviation type is unclassified and never silently treated as benign. Required count invariant: total_count = candidate_eligible_count + evidence_limitation_count + supporting_anomaly_count + unclassified_count, and each category count equals the sum of its per-type map. Contains categorical deviation type names and counts only; never raw Domain or Orchestration documents, subscriber identities, payloads, or filesystem paths. Absent on legacy summaries, which the comparator must never read as zero candidate deviations.",
            "required": [
              "total_count",
              "candidate_eligible_count",
              "evidence_limitation_count",
              "supporting_anomaly_count",
              "unclassified_count",
              "candidate_eligible_types",
              "evidence_limitation_types",
              "supporting_anomaly_types",
              "unclassified_types"
            ],
            "additionalProperties": false,
            "properties": {
              "total_count": {"type": "integer", "minimum": 0},
              "candidate_eligible_count": {"type": "integer", "minimum": 0},
              "evidence_limitation_count": {"type": "integer", "minimum": 0},
              "supporting_anomaly_count": {"type": "integer", "minimum": 0},
              "unclassified_count": {"type": "integer", "minimum": 0},
              "candidate_eligible_types": {
                "type": "object",
                "description": "Per-type counts for candidate-eligible deviations that were actually observed.",
                "additionalProperties": {"type": "integer", "minimum": 0}
              },
              "evidence_limitation_types": {
                "type": "object",
                "description": "Per-type counts for evidence limitations that were actually observed.",
                "additionalProperties": {"type": "integer", "minimum": 0}
              },
              "supporting_anomaly_types": {
                "type": "object",
                "description": "Per-type counts for supporting anomalies that were actually observed.",
                "additionalProperties": {"type": "integer", "minimum": 0}
              },
              "unclassified_types": {
                "type": "object",
                "description": "Per-type counts for deviation types that match no known category. Retained explicitly so unknown evidence always forces review.",
                "additionalProperties": {"type": "integer", "minimum": 0}
              }
            }
          }
        }
      }
    },
    "orchestration_status": {
      "type": "object",
      "description": "Analysis Orchestration execution evidence, reported separately from Domain evidence.",
      "required": [
        "execution_status",
        "output_present",
        "diagnostic_group_count",
        "source_domain_instances_count",
        "candidate_boundary_count"
      ],
      "additionalProperties": false,
      "properties": {
        "execution_status": {"type": "string"},
        "output_present": {"type": "boolean"},
        "diagnostic_group_count": {"type": "integer", "minimum": 0},
        "source_domain_instances_count": {"type": "integer", "minimum": 0},
        "candidate_boundary_count": {"type": "integer", "minimum": 0},
        "first_stop_reason": {"type": ["string", "null"]},
        "consumed_domain_instance_counts": {
          "type": "object",
          "description": "Bounded count-only evidence of which Domain contributed the instances the primary diagnostic group consumed, keyed by benchmark Domain key. Orchestration source Domain identities are mapped explicitly (5gc-registration-mobility -> registration, 5gc-pdu-session -> pdu_session, 5gc-handover-mobility -> handover_mobility); an unknown identity is retained in consumed_unmapped_source_domain_instance_count and never silently mapped to a known Domain. Counts are non-negative integers and the sum plus consumed_unmapped_source_domain_instance_count equals source_domain_instances_count. Contains no instance identifiers, source filenames or capture paths. Absent on legacy summaries, which the comparator must never read as evidence of consumption.",
          "additionalProperties": {"type": "integer", "minimum": 0}
        },
        "consumed_unmapped_source_domain_instance_count": {
          "type": "integer",
          "minimum": 0,
          "description": "Consumed instances whose Orchestration source Domain identity the benchmark does not own. Retained explicitly so unknown evidence is never attributed to a known Domain."
        }
      }
    },
    "protocol_status": {
      "type": "object",
      "additionalProperties": {
        "type": "string"
      }
    }
  }
}
