{
  "additional_evidence_needed": [],
  "boundary_confidence": null,
  "candidate_boundaries_count": 0,
  "case_id": "public-5gc-baseline-user-plane",
  "domain_instances_count": 2,
  "domain_status": {
    "handover_mobility": {
      "deviation_classification": {
        "candidate_eligible_count": 0,
        "candidate_eligible_types": {},
        "evidence_limitation_count": 0,
        "evidence_limitation_types": {},
        "supporting_anomaly_count": 0,
        "supporting_anomaly_types": {},
        "total_count": 0,
        "unclassified_count": 0,
        "unclassified_types": {}
      },
      "deviation_count": 0,
      "execution_status": "EXECUTED",
      "first_stop_reason": null,
      "handover_attempt_count": 0,
      "output_present": true,
      "path_switch_attempt_count": 0
    },
    "pdu_session": {
      "deviation_classification": {
        "candidate_eligible_count": 0,
        "candidate_eligible_types": {},
        "evidence_limitation_count": 1,
        "evidence_limitation_types": {
          "PARTIAL_CAPTURE": 1
        },
        "supporting_anomaly_count": 0,
        "supporting_anomaly_types": {},
        "total_count": 1,
        "unclassified_count": 0,
        "unclassified_types": {}
      },
      "deviation_count": 1,
      "execution_status": "EXECUTED",
      "first_stop_reason": null,
      "instance_count": 1,
      "output_present": true
    },
    "registration": {
      "deviation_classification": {
        "candidate_eligible_count": 0,
        "candidate_eligible_types": {},
        "evidence_limitation_count": 5,
        "evidence_limitation_types": {
          "PROTECTED_INNER_MESSAGE_UNAVAILABLE": 5
        },
        "supporting_anomaly_count": 0,
        "supporting_anomaly_types": {},
        "total_count": 5,
        "unclassified_count": 0,
        "unclassified_types": {}
      },
      "deviation_count": 5,
      "execution_status": "EXECUTED",
      "first_stop_reason": null,
      "instance_count": 1,
      "output_present": true
    }
  },
  "evidence_limitations": [
    "The observation window begins after the procedure's initiation evidence; capture starts mid-procedure",
    "A protected NAS envelope at frame 7 carried no decodable inner message",
    "A protected NAS envelope at frame 8 carried no decodable inner message",
    "A protected NAS envelope at frame 11 carried no decodable inner message",
    "A protected NAS envelope at frame 12 carried no decodable inner message",
    "A protected NAS envelope at frame 15 carried no decodable inner message"
  ],
  "orchestration_status": {
    "candidate_boundary_count": 0,
    "consumed_domain_instance_counts": {
      "handover_mobility": 0,
      "pdu_session": 1,
      "registration": 1
    },
    "consumed_unmapped_source_domain_instance_count": 0,
    "diagnostic_group_count": 1,
    "execution_status": "EXECUTED",
    "first_stop_reason": null,
    "output_present": true,
    "source_domain_instances_count": 2
  },
  "protocol_status": {
    "gtpu": "SUCCESS",
    "nas-5gs": "SUCCESS_WITH_PROTECTED_PAYLOAD",
    "ngap": "SUCCESS",
    "pfcp": "SUCCESS",
    "sbi-http2": "NOT_OBSERVED_IN_CAPTURE"
  },
  "selected_boundary": null,
  "selection_status": "NO_ABNORMAL_BOUNDARY_OBSERVED"
}
