{
  "additional_evidence_needed": [
    "{'candidate_id': '1-cand-1', 'reason': 'candidates resolve to the same position with no deterministic source relationship ordering them', 'requirement': 'exact frame or stage provenance that separates the tied candidates is required', 'second_candidate_id': '1-cand-2'}",
    "{'candidate_id': '1-cand-1', 'reason': 'candidates resolve to the same position with no deterministic source relationship ordering them', 'requirement': 'exact frame or stage provenance that separates the tied candidates is required', 'second_candidate_id': '1-cand-3'}",
    "{'candidate_id': '1-cand-2', 'reason': 'candidates resolve to the same position with no deterministic source relationship ordering them', 'requirement': 'exact frame or stage provenance that separates the tied candidates is required', 'second_candidate_id': '1-cand-3'}"
  ],
  "boundary_confidence": null,
  "candidate_boundaries_count": 3,
  "case_id": "public-5gc-registration-resync",
  "domain_instances_count": 2,
  "domain_status": {
    "handover_mobility": {
      "deviation_count": 0,
      "execution_status": "EXECUTED",
      "first_stop_reason": null,
      "handover_attempt_count": 0,
      "output_present": true,
      "path_switch_attempt_count": 0
    },
    "pdu_session": {
      "deviation_count": 1,
      "execution_status": "EXECUTED",
      "first_stop_reason": null,
      "instance_count": 1,
      "output_present": true
    },
    "registration": {
      "deviation_count": 13,
      "execution_status": "EXECUTED",
      "first_stop_reason": null,
      "instance_count": 1,
      "output_present": true
    }
  },
  "evidence_limitations": [
    "The observation window begins after the procedure's initiation evidence; capture starts mid-procedure",
    "A protected NAS envelope at frame 45 carried no decodable inner message",
    "A protected NAS envelope at frame 46 carried no decodable inner message",
    "A protected NAS envelope at frame 49 carried no decodable inner message",
    "A protected NAS envelope at frame 50 carried no decodable inner message",
    "A protected NAS envelope at frame 51 carried no decodable inner message"
  ],
  "orchestration_status": {
    "candidate_boundary_count": 3,
    "diagnostic_group_count": 1,
    "execution_status": "EXECUTED",
    "first_stop_reason": null,
    "output_present": true,
    "source_domain_instances_count": 2
  },
  "protocol_status": {
    "gtpu": "NOT_OBSERVED_IN_CAPTURE",
    "nas-5gs": "SUCCESS_WITH_PROTECTED_PAYLOAD",
    "ngap": "SUCCESS_WITH_UNSUPPORTED_SEMANTICS",
    "pfcp": "NOT_OBSERVED_IN_CAPTURE",
    "sbi-http2": "NOT_OBSERVED_IN_CAPTURE"
  },
  "selected_boundary": null,
  "selection_status": "AMBIGUOUS_FIRST_BOUNDARY"
}
