{
  "additional_evidence_needed": [],
  "boundary_confidence": null,
  "candidate_boundaries_count": 0,
  "case_id": "public-5gc-access-plmn-recovery",
  "domain_instances_count": 0,
  "domain_status": {
    "handover_mobility": {
      "deviation_classification": {
        "candidate_eligible_count": 0,
        "candidate_eligible_types": {},
        "evidence_limitation_count": 0,
        "evidence_limitation_types": {},
        "supporting_anomaly_count": 0,
        "supporting_anomaly_types": {},
        "total_count": 0,
        "unclassified_count": 0,
        "unclassified_types": {}
      },
      "deviation_count": 0,
      "execution_status": "EXECUTED",
      "first_stop_reason": null,
      "handover_attempt_count": 0,
      "output_present": true,
      "path_switch_attempt_count": 0
    },
    "pdu_session": {
      "deviation_classification": {
        "candidate_eligible_count": 0,
        "candidate_eligible_types": {},
        "evidence_limitation_count": 0,
        "evidence_limitation_types": {},
        "supporting_anomaly_count": 0,
        "supporting_anomaly_types": {},
        "total_count": 0,
        "unclassified_count": 0,
        "unclassified_types": {}
      },
      "deviation_count": 0,
      "execution_status": "EXECUTED",
      "first_stop_reason": null,
      "instance_count": 0,
      "output_present": true
    },
    "registration": {
      "deviation_classification": {
        "candidate_eligible_count": 0,
        "candidate_eligible_types": {},
        "evidence_limitation_count": 0,
        "evidence_limitation_types": {},
        "supporting_anomaly_count": 0,
        "supporting_anomaly_types": {},
        "total_count": 0,
        "unclassified_count": 0,
        "unclassified_types": {}
      },
      "deviation_count": 0,
      "execution_status": "EXECUTED",
      "first_stop_reason": null,
      "instance_count": 0,
      "output_present": true
    }
  },
  "evidence_limitations": [
    "No diagnostic groups emitted by orchestration"
  ],
  "orchestration_status": {
    "candidate_boundary_count": 0,
    "consumed_domain_instance_counts": {
      "handover_mobility": 0,
      "pdu_session": 0,
      "registration": 0
    },
    "consumed_unmapped_source_domain_instance_count": 0,
    "diagnostic_group_count": 0,
    "execution_status": "EXECUTED",
    "first_stop_reason": null,
    "output_present": true,
    "source_domain_instances_count": 0
  },
  "protocol_status": {
    "gtpu": "NOT_OBSERVED_IN_CAPTURE",
    "nas-5gs": "NOT_OBSERVED_IN_CAPTURE",
    "ngap": "SUCCESS_WITH_UNSUPPORTED_SEMANTICS",
    "pfcp": "NOT_OBSERVED_IN_CAPTURE",
    "sbi-http2": "NOT_OBSERVED_IN_CAPTURE"
  },
  "selected_boundary": null,
  "selection_status": "NO_DOMAIN_INPUTS"
}
